제목,시간,날짜,별점,리뷰제목,리뷰내용,연수분야,가격,대상,label
"기초학력의 첫걸음, 수학교육",15차시,2024-01-08,5,기초학습 수학부문 추천합니다!,"수학 부진의 경우, 학생의 어떤 점이 문제가 있는지 진단 및 판단부터 어려움이 있었는데 이 연수를 통해 수학의 3가지 성격(논리, 창의, 정확) 중 어디에 문제가 있는지 제대로 판단하고 그에 적절한 수업을 계획할 수 있어서 좋았습니다^^ (우리반 애 하나씩 어디에 속하는지 머리속으로 생각하게 되더라구요~) 또 정서적으로 문제가 있는 학생은 어떻게 지도해야하는지 다양한 예를 통해 자세하고 구체적으로 내용을 언급해주셔서 좋았습니다!",교과지도,"40,000원",전체대상,1
이보영의 바로 떠나는 왕초보 여행영어,30차시,2024-04-29,5,영어회화 공부가 재미있어요,"해외여행 시 꼭 필요한 내용으로 구성되어 많은 도움이 되었습니다._x000D_
똑부러진 강의로 쉽고 귀에 쏙쏙 들어와서 좋네요^^",어학,"75,000원",전체대상,1
큰별쌤 최태성의 별★별한국사,30차시,2024-06-10,5,한국사 연수,재밌고 유익한 한국사 연수였습니다~!,교과지도,"75,000원",전체대상,1
야나두 미국에서 한 달 살기- 현지 토크 편,15차시,2024-06-09,5,고급진 표현 익히기에 딱 좋은 연수,평소 원어민교사와 대화를 자주 해도 사용하지 않는 표현을 연수를 토앻서 많이 배웠습니다. 특히 강사님들의 현지 경험담이 도움이 많이 되었습니다. 감사합니다!! ,어학,"40,000원",전체대상,1
"기초학력교육, 관계형성이 먼저다.",15차시,2024-06-13,5,딱딱할 줄 알았으나 부드러운 강의 내용,"기초학력 교육이라 그래서, 이미 알고 있는 내용을 가르칠 것이라 생각해서 별 기대없이 들었던 연수였습니다. 그런데 기초학력에 도움되는 사이트 설명이나 부진아 들에게 도움이 되는 다양한 보드게임을 소개해주셔서 재밌게 들었습니다. 이렇게 학생들이 흥미를 가질 만한 지도 내용을 소개해주셔서 실제로 활용할 때 도움이 많이 될 것 같아요!",학습지도,"40,000원",유초등,1
부자 교사의 재테크,15차시,2024-05-09,5,기본 경제 교육으로 좋습니다.,경제 관련 기본 용어에 대한 이해의 폭을 넓히는데 무척 좋습니다. 연수 제목 자체가 재미있어서 신청해봤는데...부자 교사 되기는 쉽지 않은 것 같습니다.,자기계발,"50,000원",전체대상,1
"가장 쉬운 수업도구, 패들렛과 띵커벨",15차시,2024-01-22,5,연수 잘 들었습니다!,2024년 수업에 활용하고자 수강 신청하게 되었습니다~토론 수업을 포함한 수행평가에도에활용할 수 있을 거서 같아 많은 도전감을 받고 갑니다~ 감사합니다~,ICT,"40,000원",전체대상,1
"챗GPT 융합교육 가이드, 인공지능(AI) 챗봇 수업",15차시,2024-06-12,5,유익한 연수,챗GPT의 활용에 대해 고민해 보는 유익한 연수였습니다.,학습지도,"50,000원",유초등,1
신영일과 함께하는 안전교육 365,15차시,2024-04-12,4,3년 필수 안전연수로 추천!,안전연수로 강력 추쳔합니다. ,생활지도,"40,000원",전체대상,0
소설 파친코와 썬킴의 한국근현대사,15차시,2024-01-13,5,집중해서 듣게 되는 한국 근현대사,"정말 집중해서 들었습니다. 역사 스토리텔러라고 본인을 소개해주셨는데요, 정말 유능하신 스토리텔러이십니다. 간간이 들려 주시는 샛길 이야기(시모노세키 식당에서 체결되어 시모노세키 조약이 된것, 베트남의 프랑스 음식, 가미카제 특공대의 필로폰 술, 초밥 2피스 기원, 작전의 이름에는 아무 의미 없다는 예시로 월미도 디스코 팡팡작전이라고 이름짓지 않는다는 이야기 등)로 더 깊게, 재밌게 들을 수 있었습니다. _x000D_
대한민국의 모든 분이 들었으면 하는 강의입니다. _x000D_
_x000D_
다만, 썬킴쌤께서는 '팩트만' 말하겠다 강조하셨지만, 그 '팩트' 가 한 쪽의 입장만의 팩트라는 점이 아쉬웠습니다. 4.3 사건의 경우, 제주도의 주민들이 학살된 것은 팩트이지요. 그러나 3.1운동 준비 기간의 제주도의 분위기(남로당이 대세인 점, 남로당의 지령이 있었던 점 등)는 사료로 증명된 부분이 많음에도 불구하고 하나도 언급을 안 하셨습니다. 둘째로 이승만 대통령 관련입니다. 3.15부정선거는 명백한 과오입니다. 부정할 수 없는 일이지요. 그러나 초대 대통령으로서 공적은 단 하나도 언급하지 않으셨습니다. 아, 휴전에 반대하면서 북진 통일을 주장했다는 것을 살짝 언급하고 가셨습니다만, 그 이전에 포로 교환과 그로 인한 한미상호방위조약의 체결, 그 효과에 대해 언급할 만한 내용이 아닐까요? 이승만에 대해 오로지 3.15부정선거를 일으킨 독재자라는 인식이 팽배한 한국 교육에서 그에 대한 객관적인 공과 과에 대한 평가가 이런 강의에서조차 이루어지지 않는 것은 매우 유감스러운 일이라 생각됩니다. 적어도 선생님들이 역사적 진실에 대해 치우쳐 알아서는 안 되는 일인데 말입니다. _x000D_
_x000D_
이런 부분에 대해 강의자의 판단이 아니라 객관적인 자료의 언급을 해 주셨으면 합니다. _x000D_
_x000D_
한국의 근현대사에 대해 정말 재밌게, 집중하여 공부하였습니다. _x000D_
역시 역사 스토리텔러이십니다. ",교과지도,"50,000원",전체대상,1
"함께 만드는 어울림, 다문화교육",30차시,2024-01-07,5,유익한 강의,실제 수업하는 장면과 같은 사례도 많이 나오고 해서 매우 유익했습니다. 감사합니다^^,생활지도,"65,000원",전체대상,1
"소통하는 학교, 참여하는 수업을 위한 교사의 퍼실리테이션 역량키우기",30차시,2024-02-05,4,궁금했던 연수,"퍼실리테이션에 대해 항상 궁금했었는데 드디어 연수를 찾아서 듣게 되었습니다. 수업에서의 퍼실리테인션이 주이다 보니 제가 기대했던 방향과는 차이가 있었지만 대략적인 이해와 궁금증 해결에 도움이 되었습니다._x000D_
학교에서 교무회의, 학부모 회의 등 사례를 중심으로 한 짧은 시간의 연수가 더 개설되었으면 합니다.감사합니다.",학습지도,"75,000원",전체대상,0
옥이샘의 뚝딱 미술로 여는 학급운영,15차시,2024-02-22,5,유익합니다,유익하게 잘 듣고 잘 활용했습니다. 감사합니다,학급경영,"40,000원",유초등,1
다양한 재료로 쉽게 따라 하는 캘리그라피,15차시,2023-12-27,5,아이들의 내면이 단단해지는 격려수업,"올해는 이미....지났고요._x000D_
내년에 아이들과 이런 수업을 적용해 보겠습니다._x000D_
좋은 연수 감사해요~",자기계발,"40,000원",전체대상,1
"가장 쉬운 수업도구, 패들렛과 띵커벨",15차시,2024-05-10,5,정리의 재발견 공간정리,평소 정리정돈에 관심이 많은 편이라 편안한 마음으로 연수에 임했어요. 유용한 꿀팁 전수 감사합니다.,ICT,"40,000원",전체대상,1
"가장 쉬운 수업도구, 패들렛과 띵커벨",15차시,2024-02-19,4,수업 예시,수업에서 사용할 수 있는 여러 예시가 좋습니다.,ICT,"40,000원",전체대상,0
"쉽게 쓰고, 소품으로 완성하는 캘리그래피",15차시,2024-01-17,5,실제적이고 소품을 직접 사용해가며 하는 연수~,다양한 서체와 아이디어를 배우고 실제 소품을 이용하여 한 작품씩 완성해가는 재미가 좋습니다. 단계별로 천천히 과정을 보여주어 따라하는데 힘들지 않습니다^^ 물론 글씨 연습은 정성껏 연습을 많이 해야 완성도가 더 높아지겠지요~,자기계발,"40,000원",전체대상,1
온라인에서도 놀자! 허쌤의 비접촉놀이,10차시,2023-12-17,5,온라인에서도 놀자! 허쌤의 비접촉놀이,다양한 놀이 방법을 알게 된 좋은 연수~,학습지도,"30,000원",유초등,1
"[자율연수] 탤짱쌤의 컴퓨터 활용 꼼수, 이 정도면 나도 스마트",7차시,2024-01-23,5,잘들었습니다~,컴퓨터를 활용하는데 도움이 되었습니다. 감사합니다,ICT,무료,전체대상,1
조병영의 문해력 수업,30차시,2024-06-04,3,잘 들었습니다. ,전반적인 문해력에 대해 짚어주는 강의였습니다.,학습지도,"75,000원",전체대상,0
"장애공감교육, 달라도 괜찮아",5차시,2023-12-17,5,장애인식교육에 큰 도움이 됩니다.,"모든 선생님들에게 꼭 추천드립니다_x000D_
저에게 큰 도움이 되었습니다._x000D_
만족합니다. 이 배움을 바탕으로 학생을 잘 지도하겠습니다._x000D_
감사합니다.",생활지도,"15,000원",전체대상,1
"엑셀의 신, 학교에서 쓰는 쉬운 엑셀",30차시,2024-01-23,5,엑셀의 신에 도전,엑셀의 신에 도전하고 싶은 마음에 신청했습니다. 엑셀을 알면 업무 효율이 몇십배 몇백배 늘어나는 것 같습니다. 활용성 높은 기능을 알려주셔서 도움이 많이 되었습니다. 감사합니다.,ICT,"75,000원",전체대상,1
설민석의 한국사능력검정시험[심화],60차시,2024-05-28,5,한국사능력검정,연수시험이 너무 어렵습니다. 혹시 연수성적 필요하시면 다시 생각해보세요.,학습지도,"130,000원",전체대상,1
하루 20분! 나만을 위한 '나마스떼' 힐링 요가,15차시,2024-02-05,5,유익한 연수,"유튜브를 통해 홈트로 요가를 따라 하게 되는데, 바른 자세나 용어를 모른체 따라했던 것을 이 연수를 통해 바른 자세를 익히게 되고 동작에 따른 용어를 알게 되어 유익했습니다. 배운대로 열심히 운동을 해야겠습니다.",자기계발,"40,000원",전체대상,1
"Made at Home, 나만의 작은 홈카페 & 홈베이킹",15차시,2023-12-28,5,홈카페에 관심이 있다면?!,"평소 홈카페에 관심이 많은데, 집에서 카페를 즐기고 싶으신 분이라면 추천드립니다.",자기계발,"40,000원",전체대상,1
가르침에 지친 당신을 위한 방구석 인문학,30차시,2024-04-12,4,다양한 시선으로 나의 삶 바라보기 ,"문학적인 면, 예술적인 면 그리고 철학자의 시선과 이론으로 나의 삶을 여러가지 방향으로 바라볼 수 있는 기회였습니다. 내용은 저는 다소 어려웠습니다.",자기계발,"75,000원",전체대상,0
교사를 위한 15가지 마음 공부,15차시,2024-02-13,5,심리학으로 배우는 학교생활의 지혜,"심리학이라는 주제가 참 흥미로워서 여러가지 책들을 읽어보았었는데요._x000D_
이것들을 실생활과 학교생활에 어떻게 적용해야 할 지는 언제나 막막했었습니다._x000D_
하지만, 이 연수를 듣고 나니 그동안 지식으로만 존재했던 심리학 관련 상식들이 삶의 지혜로 자리잡아 내 삶을 좀 더 편안하게 만들어주는 느낌입니다._x000D_
동료 선생님들과의 관계, 학교생활을 더욱 유연하게 잘 해나갈 수 있을 것 같아요._x000D_
_x000D_
학생들을 지도할 때도 심리학을 활용할 수 있으면 더 좋을 것 같단 생각도 듭니다!_x000D_
_x000D_
유익한 연수를 통해, 영감을 얻어갑니다. 감사합니다!!",생활지도,"50,000원",전체대상,1
"생각을 꺼내는 교육, 이제는 IB 시대",15차시,2024-05-16,5,IB교육에 대해 관심이 생겼어요,"학생들의 생각을 꺼내 잘 다듬고 소통하는 방안을 고민하던 중_x000D_
IB 교육을 잘 모르는 상황에서 연수를 듣게 되었습니다._x000D_
연수를 듣고 IB에 관심이 생겼고 초등 수업 및 교육과정에 적용해 보고 싶습니다. _x000D_
좀더 전문적인 과정의 연수가 생긴다면 참여해 보고 싶습니다.",학습지도,"50,000원",전체대상,1
학습격차를 줄이기 위한 슬기로운 수업방안,15차시,2023-12-26,5,현저하게 성적이 떨어지는 학생을 위한,"비교적 고른 성적 분포를 보이는 학급에서 유독 두 명이 성적이 너무 낮았습니다. 수업 시간 나름 개별 과제 및 지도를 한다고 하였는데, 큰 변화를 보지는 못하였구요. 해당 연수를 통해 지도하던 방법을 점검해 볼 수 있었고, 참고할 수 있는 내용들도 제법 있었습니다. 유익한 연수였습니다.",학습지도,"40,000원",중등,1
"엑셀의 신, 학교에서 쓰는 쉬운 엑셀",30차시,2024-05-20,5,꼭 필요한 연수,꼭 필요한 연수 쉽게 잘 배웠습니다. 감사합니다.,ICT,"75,000원",전체대상,1
"[자율연수] 탤짱쌤의 컴퓨터 활용 꼼수, 이 정도면 나도 스마트",7차시,2023-12-21,5,맞춤 연수,좋은 내용 연수에 감사드립니다.,ICT,무료,전체대상,1
"우리 반 마음 탐구, 교실 심리학",30차시,2023-12-17,5,아주 좋아요.,학급에서 아이들을 대상으로 생각하면서 들으면 효과적입니다. ,생활지도,"85,000원",유초등,1
어쩌다 바다 건너 유럽 미술에 빠지는 순간,30차시,2024-01-17,5,힐링 미술 여행 ~~ ,도슨트의 설명을 들으며 미술 작품을 볼 때 그동안 알지 못했던 예술의 세계로 들어서는 느낌이 든다. 작가가 표현하려고 했던 점들을 좀 더 섬세하게 살펴볼 수 있어서 매 강의마다 즐겁고 뿌듯한 감정이 든다. ,자기계발,"85,000원",전체대상,1
성인도 말문이 터지는 엄마표 영어의 모든 것,15차시,2024-02-29,5,엄마표 영어를 하려면 반드시 들으세욧~~,"엄마표 영어에서의 핵심이 무엇인지에 대해 쏙쏙 가르쳐주는 강의, 추천합니다!",자기계발,"40,000원",전체대상,1
하루 20분! 나만을 위한 '나마스떼' 힐링 요가,15차시,2023-12-15,4,수양,해도 해도 계속 생겨나는 업무에  마우스 내려두고 간만에 펜을 잡고 힐링합니다. 정신 수양에 도움 됩니다.,자기계발,"40,000원",전체대상,0
양수쌤의 한 방에 끝나는 놀이체육,30차시,2024-01-14,5,아이들이 너무 너무 좋아할 것 같아요,"소규모와 대규모 학급의 체육수업에 다양하게 활용할 수 있는 놀이체육을 통해서 학생들의 체육에 더욱더 열심히 참여할 수 있는 기회를 제공할 수 있을 것 같아서_x000D_
추천드립니다.",교과지도,"75,000원",전체대상,1
말로 통하는 슬기로운 교사 생활,30차시,2024-05-27,4,학교생활에서 도움이 되는 내용 많네요,"다만 21번째 강의에서 '문제행동을 하는 학생을 잠시 특별실(상담실이나 보건실)로 보낸다' 라고 하셨는데요. 요즘 학생들은 일부러 수업 시간에 특별실을 찾을 만큼 특별실 핑계로 수업을 늦거나 재미로 자주 찾는 학생들이 많습니다. 그래서 격리장소로 특별실을 이용했을 경우 강화가 되어 더 자주 문제행동을 하는 경우가 많더라구요._x000D_
",자기계발,"75,000원",유초등,0
HOLA! 스페인어 첫걸음 - 기초완성,15차시,2024-01-25,5,유익한 스페인어 강좌,스페인어 발음 기초부터 스페인어권 지역을 여행할 때 실전에 사용할 수 있는 문장을 익혀주는 유용한 연수입니다. 바로 사용할 수 있는 스페인어를 공부하시고 싶은 분에게 강추합니다.,어학,"40,000원",전체대상,1
"생각을 꺼내는 교육, 이제는 IB 시대",15차시,2024-06-09,5,교육의 변화가 시급한 때,"교사를 변화의 주체로 _x000D_
평가를 핵심 변화로_x000D_
당면한 미래를 준비하는 _x000D_
연수라고 생각해요.",학습지도,"50,000원",전체대상,1
하루 20분! 나만을 위한 '나마스떼' 힐링 요가,15차시,2024-01-19,5,쉬운 MBTI 연수,구체적인 상황을 들어 자세하게 설명해 주어서 유익했습니다. ,자기계발,"40,000원",전체대상,1
아는 만큼 즐기는 올 댓 와인,15차시,2024-05-03,5,교육과정 설명,"마트에서 권하는 와인이 아닌, 설명서를 읽고 고를 수 있는 수준이 되었습니다. 무식함에서 조금 탈출한 느낌입니다. 와인상식 감사합니다.^^",자기계발,"40,000원",전체대상,1
부자 교사의 재테크,15차시,2024-04-25,5,아파트부터 장만하기,"재테크는 사회생활 시작부터 15년이내가 가장 좋다. 이 때에 아파트를 마련할 목적을 가지고 절약, 저축을 하고 대출을 적절히 이용하여 목표를 이룰 것을 강조하고 있다. 정말 사회초년생부터 꼭 들어야할 필요한 강의이다. ",자기계발,"50,000원",전체대상,1
한 번에 끝내는 미래 교육! 디지털 어벤져스의 특별한 AI 특강,15차시,2024-04-04,5,유익한 연수,미래 AI 관련 교육에 대해 알게되었고 유익한 강의 감사합니다.,학습지도,"40,000원",전체대상,1
학급 관리부터 업무까지 한 방에! 교사를 위한 노션 활용법,15차시,2024-05-20,2,불친절한 강의,"이미 노션을 사용하고 있는 상태에서 좀더 알고 싶어 수강신청했습니다. 그런데.. 이미 노션을 어느 정도 사용할 수 있음에도 불구하고, 강의를 따라가기가 쉽지 않더군요. 강사님과 함께 앱을 활용하여 내용을 만들어 가는 과정을 강의할 때도 혼자 작업하는 것처럼 너무 빠르게 별다른 설명없이 진행이 되었습니다. (내용을 채워넣는 단계에서 빠르게 입력하는 것을 보여주는 경우를 말하는 것이 아닙니다) 계속 강의를 멈추고 어느 것을 눌러야 하는지 찾고 연구해 가며 들은 강의였습니다. _x000D_
좀더 천천히 어느 것을 선택하고 클릭해야 하는지 알려주셔야 배우는 데 도움이 될 것 같습니다.",ICT,"50,000원",전체대상,0
교사를 위한 구글 활용법(입문자편),15차시,2024-04-01,5,똑똑한 교실 만들기,똑똑하고 편한 교실을 만들수있어요,ICT,"40,000원",전체대상,1
지금 바로! 칼림바,15차시,2024-04-18,5,처음 들어보는 악기 연수!,"악기 조율부터 다양한 칼림바 연습 악보들, 그리고 생전 처음 접해본 초보도 쉽게 도전해보고 배울 수 있도록 꼼꼼하게 연습, 지도해주시는 강사님... 다른 악기 연수도 있다면 또 도전해보고 싶습니다. 어떻게 시간이 지나갔는지 모를 정도로 참 재밌게 배웠습니다. 감사합니다.  ",교과지도,"50,000원",전체대상,1
어쩌다 바다 건너 유럽 미술에 빠지는 순간,30차시,2024-02-13,5,아주 좋아요,늘 알고 싶고 가고싶은 미술작품과 유럽 곳곳을 잘 알고 보고 갑니다. 학생들 미술지도에 큰 도움이 되겠어요. 감사합니다.^^,자기계발,"85,000원",전체대상,1
"골프, 초보에서 필드까지",30차시,2024-06-11,5,이론과 실전,실전에 필요한 이론을 무장함,자기계발,"85,000원",전체대상,1
교사를 위한 구글 활용법(입문자편),15차시,2024-05-21,4,갈수록 궁금해지는 뇌과학,뇌에 관련된 용어들이 잘 익숙해지지는 않았지만 일상 속에서 겪게 되는 일들을 뇌과학의 입장에서 자세히 알려주셔서 도움이 되었어요. ,ICT,"40,000원",전체대상,0
하지현의 감정수업,30차시,2024-02-21,5,정말 강추강추 연수!!!,"학생 정서심리 관련한 연수로 들었지만, 교사인 나도 힐링을 받는 너무 좋은 연수였습니다!_x000D_
주변 선생님들한테 진심으로 적극적극 추천드립니다^^",생활지도,"85,000원",전체대상,1
"탤짱쌤의 컴퓨터 활용 꼼수, 이제 나도 스마트",15차시,2024-04-25,5,신규 교사들의 재테크에 도움이 많이 될 듯 합니다. ,다음에는 퇴직을 앞두고 있는 교사들을 대상으로 한  유용한 경제  연수를 부탁드립니다. ,ICT,"40,000원",전체대상,1
법정의무교육 한 번에 이수하기,15차시,2024-02-05,5,유익한 연수,학생들을 지도하면서 꼭 필요한 여러 가지 법정의무교육을 모아 한 번에 연수 받을 수 있어서 아주 편리하고 유익했습니다. 감사합니다.,생활지도,"40,000원",전체대상,1
독서지도사 양성과정 1,30차시,2024-04-28,5,독서지도의 전문가가 될 수 있는 연수,"늘 학생들에게 독서수업 및 글쓰기 지도를 하면서도 뭔가 내 자신이 부족하다는 느낌을 지울 수 없었는데, 이번 연수를 통하여 독서수업 준비를 어떻게 해야할지, 학생들에게 독서습관 및 독후활동을 어떻게 하면 재밌있게 할지, 독서토론 방법 등을 제대로 배울 수 있었던 시간이었던 것 같다.",학습지도,"85,000원",전체대상,1
현아샘의 단단하고 따뜻한 그림책 학급운영,30차시,2024-05-12,4,다양한 그림책 소개가 좋았다.,다양한 그림책을 알게 되고 그림책을 통해 어떻게 학급을 운영하는 것이 좋을지 다방면의 예시를 볼 수 있어서 좋았다. ,학급경영,"75,000원",유초등,0
"생각을 키우는 힘, 파이선 코딩 스쿨",30차시,2024-05-15,5,미래 교육,"다양한 고민을 하다가 수강한 연수였다._x000D_
생소한 용어들이 많지만, 여유를 갖고 차근차근 따라하면 어렵지 않다._x000D_
앞으로 컴퓨터를 중심으로 생활하게 될 아이들._x000D_
그 아이들의 학습 코칭을 위해 나 자신부터 변해야 할 필요가 느껴질 때._x000D_
미래 교육을 준비하기 위해 뭔가 해야겠다는 생각이 들 때_x000D_
들으면 좋은 연수일 것 같다.",ICT,"75,000원",전체대상,1
"엑셀의 신, 학교에서 쓰는 쉬운 엑셀",30차시,2024-01-24,5,유익한 연수!,"학교에서 보직을 맡으면서 수많은 공문을 엑셀로 처리해야할 때가 많은데_x000D_
엑셀의 기능에 대해서 자세히 알 수 있어서 아주 유익한 강의였습니다._x000D_
많이 연습해서 실무에 사용할 수 있도록 노력해야겠습니다.",ICT,"75,000원",전체대상,1
"Made at Home, 나만의 작은 홈카페 & 홈베이킹",15차시,2023-12-20,4,홈카페 홈베이킹 연수 후기,평소 홈카페에 관심이 많아서 카페 음료나 간단한 케익종류를 만들어보고 싶어서 수강하게 되었어요. 강사선생님의 꿀팁과 친절한 설명 차분한 말투로 귀에 쏙 쏙 들어오더라구요 이젠 지인을 초대해 카페 음료를 대접해도 자신이 생겼어요~복잡하지도 않고 간단하면서 맛있는 카페 메뉴를 잘 활용해 봐야겠어요~~,자기계발,"40,000원",전체대상,0
"몰입과 학습을 한 번에, 교실 속 게이미피케이션",15차시,2024-03-09,5,good lessons ,좋은 수업이었습니다. 다양한 게임 활동을 통해서 흥미로운 교실 수업을 해보도로 가겠습니다. ,학습지도,"50,000원",전체대상,1
"기초학력교육, 관계형성이 먼저다.",15차시,2024-04-18,4,다양한 게임을 접하며,이미 알고 있던 게임과 새로 알게 된 게임을 보면서 나도 틈이 날 때 우리 반 학생들과 재미있게 해 봐야겠다는 생각이 드는 연수였어요...,학습지도,"40,000원",유초등,0
생활지도부터 학습지도까지! 1학년 한해살이 완벽 가이드,30차시,2024-03-11,5,1학년 생활 및 학습지도,연수를 통해 1학년 학생들을 어떻게 지도해야 될지 감이 생겼습니다. ,생활지도,"75,000원",유초등,1
한 번에 끝내는 미래 교육! 디지털 어벤져스의 특별한 AI 특강,15차시,2024-05-15,5,인공지능의 기본에 대해 알 수 있었어요.,"인공지능에 대한 기본 상식과 이론을 알 수 있어 유익한 연수였어요._x000D_
각 분야의 전문가들의 설명이라 더 믿음이 가고 전달력있는 강사분들이라 좋았네요. ",학습지도,"40,000원",전체대상,1
"가장 쉬운 수업도구, 패들렛과 띵커벨",15차시,2024-05-14,5,패들렛 후기,패들렛을 체계적으로 수업에 도입하기 아주 좋은 강의입니다. 옆반 선생님에게도 강추합니다~,ICT,"40,000원",전체대상,1
단단한 내면의 힘을 기르는 지나영의 코어 마인드,15차시,2023-12-19,5,삶을 살아가는 데 있어서 너무 유익한 연수였습니다!,"심리적으로 불안과 우울감이 느껴질 때나 타인으로 상처를 받았을 때 연수 내용을 통해 학습한 마인드트레이닝, 4-2-4 호흡법, I get to용법 등 여러 가지 방법들을 활용하여 긍정적으로 살아갈 수 있는 데 연수 내용들이 많은 도움이 될 것 같습니다. 삶을 살아가면서 외적동기보다 내적동기를 향상시켜줄 수 있는 삶을 살아갈 수 있도록 노력해야 할 것 같습니다.",자기계발,"50,000원",전체대상,1
왕초보도 할 수 있는 실전 여행영어,30차시,2024-01-15,5,여행을 앞두고 단기 속성으로 공부하는데 무척 도움이 되었어요~,여행을 앞두고 단기 속성으로 공부하는데 무척 도움이 되었어요~,어학,"65,000원",전체대상,1
생활지도부터 학습지도까지! 1학년 한해살이 완벽 가이드,30차시,2023-12-22,5,완벽한 1학년 준비,1학년에 적합한 생활 지도와 학습지도 방법까지 내용이 정말 알찹니다. 강추합니다.,생활지도,"75,000원",유초등,1
