제목,시간,날짜,별점,리뷰제목,리뷰내용,연수분야,가격,대상,label
알면 편한 심리학 with 유미의 세포들,30차시,2024-01-07,5,추천,심리학에 대한 기본 소양이 교사에게 꼭 필요했는데 매우 유익한 연수였습니다.,자기계발,"75,000원",전체대상,1
"공간의 재발견, 정리의 힘",15차시,2023-12-20,5,공간 정리의 힘!,"집안 정리를 좀 더 깔끔하게 하고싶어서.._x000D_
유튜브에도 많지만 또 직무연수로 들으면 더 열심히 들을 것 같아 수강했어요._x000D_
만족합니다.",자기계발,"40,000원",전체대상,1
"세계의 명화, 위대한 화가들의 놀라운 미술 이야기",60차시,2024-02-20,5,다양한 미술사조와 미술작품 이해,박물관에 보았던 미술작품에 대한 이해와 다양한 화가 이야기를 들을 수 있었음,자기계발,"140,000원",전체대상,1
[집밥 한 끼] 맛있는 다이어트 + 건강한 밥상,15차시,2024-01-25,5,집밥 백쌤!! 나도 할 수 있다~~,요알못인 사람들도 백쌤만큼 요리 할 수 있을 것 같은 연수입니다,자기계발,"40,000원",전체대상,1
그림책으로 배우는 삶과 죽음,30차시,2024-05-21,5,그림책으로 배우는 삶과 죽음,"연수 들으면서, 눈물이 나와서, 살짝 당황했습니다. 이렇게 많은 이야기가 있는 그림책들을 접할수 있어서. 유익했습니다. ",생활지도,"85,000원",전체대상,1
다름을 이해하는 교실 속 통합교육,30차시,2024-04-24,5,다름을 이해하는 교실 속 통합교육,다름을 이해하는 교실 속 통합교육 연수 잘 봤습니다.,생활지도,"65,000원",전체대상,1
하지현의 감정수업,30차시,2024-03-06,5,알기 쉽게 설명해주시는 감정/심리학 수업,진짜 너무 좋았어요.. 이해하기 쉽게 설명해주시고 내용이 참 알차고 도움이 많이 돼서 메모하면서 들었습니다! 두번씩 들어도 좋은 최고의 강의입니다~~,생활지도,"85,000원",전체대상,1
"감성을 엮는 시간, 라탄 공예",15차시,2024-04-02,4,추천합니다~,"강사님께서 차분한게 잘 설명해주셨습니다._x000D_
_x000D_
다만 라탄 공예 기술을 다 외고 있지 않은 상황에서_x000D_
영상만 보고 따라할 때 영상의 각도때문에 _x000D_
특정 단계가  잘 이해 되지 않았던 적이 많았습니다._x000D_
 _x000D_
특히 기술이 변경될 때  그 부분을 확대해서 느리게 보여준다거나,_x000D_
여러 각도에서 촬영해주는 영상이 첨부된다면 좋을 것 같습니다._x000D_
또 사릿대를 추가할 때 미리 사릿대의 길이도 안내되면 좋을 것 같습니다._x000D_
_x000D_
이상 똥손이었습니다.",자기계발,"40,000원",전체대상,0
"함께 만드는 어울림, 다문화교육",30차시,2024-06-04,5,다문화의 필요성,우리반에도 엄마가 베트남 사람인 아이가 있습니다. 도움 많이 받았습니다.,생활지도,"65,000원",전체대상,1
아이들의 내면이 단단해지는 격려수업,15차시,2024-01-06,5,좋은 연수,"고학년 학생들에게 적용하면 좋을 것 같습니다. 학생들이 자신과 가족, 친구들, 선생님을 돌아보며 서로에게 위로와 격려를 전할 수 있는 활동이라 정말 좋았습니다.",생활지도,"50,000원",전체대상,1
폭력 교실에 맞서는 용기,30차시,2024-03-26,4,잘 들었습니다. ,잘 들었습니다. 다양한 관련 연수가 개설 되었으면 좋겠습니다.,생활지도,"75,000원",중등,0
"공간의 재발견, 정리의 힘",15차시,2024-05-21,5,정리의 힘,집안을 잘 정리하고. 나를 잘 살펴봐야겠습니다. ,자기계발,"40,000원",전체대상,1
"공간의 재발견, 정리의 힘",15차시,2024-01-18,5,매우 유용한 연수,"정리의 필요성과 디테일한 영역의 정리 방법까지 쉽게 적용할수 있도록 도와주는 최고의 강의다._x000D_
정리하며 인생을 다시 돌아 보는것, 비워가며 가볍게 인생을 살아가는 의미를 생각해본 연수였다._x000D_
공간뿐만 아니라 인생을 정리하며 가볍고 심플하게 살아가는데 큰 동기 유발이 된 연수라서 많은 선생님들께 적극 추천합니다._x000D_
",자기계발,"40,000원",전체대상,1
소설 파친코와 썬킴의 한국근현대사,15차시,2024-02-19,5,한국근현대사,한국 근현대사를 재미있게 배울 수 있었습니다.,교과지도,"50,000원",전체대상,1
"몰입과 학습을 한 번에, 교실 속 게이미피케이션",15차시,2024-04-15,5,보드게임을 좋아하는 선생님이라면 강추,"평소 보드게임을 좋아하시는, 관심있는 선생님들께 강추드리는 연수입니다._x000D_
보드게임을 활용해 수업을 진행하고 싶었으나, 어떻게 교과와 연계할 수 있는지, 보드게임 활용 수업을 진행할 때의 유의점, 꿀팁들이 많이 들어 있는 연수입니다._x000D_
그리고 평소 취미로 보드게임을 할 때에 어떻게 하면 수업, 교과와 연계할 수 있을 지에 대해서 곰곰히 생각을 하게 되는 연수입니다._x000D_
좋은 연수 감사합니다^^",학습지도,"50,000원",전체대상,1
아이스크림으로 완성하는 에듀테크,15차시,2024-04-11,5,아이스크림을 잘 활용할 수 있는 유익한 연수,"아이스크림을 잘 활용하여 에듀테크 수업을 할 수 있는 유익한 연수였습니다._x000D_
그동안 아이스크림은 진도 나갈 때 주로 활용했는데 다양한 에듀테크 수업 방식을 알게 되어 실제 수업에서도 잘 활용할 수 있을 것 같습니다._x000D_
강사님께서 설명을 아주 자세히 해주셔서 쉽게 이해할 수 있었으며, 실제 수업 사례를 보여주셔서 수업에서 활용되는 모습도 볼 수 있어 좋았습니다._x000D_
아이스크림 활용에 있어 아주 많은 도움이 되었습니다. 추천합니다.",ICT,"50,000원",유초등,1
"마음을 이어주는 마법, 타로 이야기",30차시,2024-03-25,5,재미있는 타로 수업,카드.책까지 와서 쉽고 재미있게 타로를 배웠어요.,자기계발,"75,000원",전체대상,1
연수로 완성하는 아이스크림 수학 교과서(4학년),15차시,2024-01-30,5,재미있는 과학 수업,특수교육 대상 학생들 지도하는데 학생들에게 과학을 쉽고 재미있게 접근할 수 있는 다양한 방법을 얻었고 교수학습 연구에 많은 도움이 되었습니다.,교과지도,무료,유초등,1
"틀을 깬 수업, 미래 교실을 열다",30차시,2024-04-15,5,재미있게 깊이있게 가르치고 싶다면,"선생님이 가르치는 수업이 아닌_x000D_
아이들이 스스로 배워 나가는 수업을 도전해 보고 싶다면 추천합니다!",학습지도,"65,000원",유초등,1
"마을이 잇는 교육, 교육이 짓는 아이들 마을교육공동체(실무자편)",15차시,2024-05-09,5,마을교육공동체 ,사례중심이어서 어렵지 않고 좋앗어요.,학습지도,"40,000",전체대상,1
디지털 드로잉으로 학급경영하기,30차시,2023-12-26,5,꼭 필요했던 연수,"꼭 필요했던 연수입니다. _x000D_
그동안 마음으로만 가득했던 학급운영 방법을 디지털 드로잉으로 해결할 수 있을거 같아 너무 기쁩니다!_x000D_
막연했던 내용인데 이렇게 쉬웠다니~!_x000D_
아마 선생님들께서 잘 가르쳐 주셔서 그렇겠지요. _x000D_
요즘은 유튜브나 여러 공간에서 배울수도 있지만 교사에게 알맞은 내용으로 한차시 한차시 고심해서 고르시고 구성하신게 느껴졌어요. _x000D_
저도 얼른 드로잉 연습해서 내년에는 더 알찬 학급 운영해보고 싶습니다!_x000D_
감사합니다! ",학급경영,"75,000원",전체대상,1
구글 설문을 활용한 온라인 수업 준비기,6차시,2024-01-23,5,좋은연수 감사합니다~^^,"잘 몰랐던 구글 설문지부분도 이해가 잘 되게 쉽게 설명해주시고_x000D_
좋은자료까지 공유해주셔서 너무 감사드립니다~^^_x000D_
구글관련 설문지 말고도 좋은연수가 계속 들을수 있었으면 좋겠습니다~!",학습지도,무료,중등,1
한국어교원양성과정 Ⅰ,30차시,2024-04-27,5,오랜만에 정말 대학 강의 받는 느낌을 받았어요.,원격 연수의 특성 상 편안하게 듣는 것을 선호하는데 이 연수는 자격증을 대비하는 것이다보니 가볍게 들은 수 있는 연수는 아니었다. ,자기계발,"75,000원",전체대상,1
학습격차를 줄이기 위한 슬기로운 수업방안,15차시,2024-06-13,5,학습격차를 줄이기 위한 슬기로운 수업방안,좋은 연수 잘 들었습니다. 많은 도움이 되었습니다.,학습지도,"40,000원",중등,1
"4R'S로 키우는 힘, 기초학력교육",30차시,2023-12-22,5,도움되었어요~,교과별 보드게임으로 지도하기 등 학생이 흥미를 가질만한 내용이 많이 포함되어 있어 더욱 실질적이고 큰 도움이 되었습니다. 감사합니다.,학습지도,"75,000원",유초등,1
재미있는 법률여행,30차시,2024-04-02,5,법을 알아가는 유익한 연수 ,"법률 여행 연수를 듣고, 남은 교직 생활에서 부당한 일을 겪지 않는 법을 배울 수 있어 좋았습니다. 어려운 법률 용어도 알아가는 연수가 되었습니다.",자기계발,"85,000원",전체대상,1
"기초학력의 첫걸음, 한글교육",15차시,2024-03-25,5,1학년 선생님이라면 꼭 한번 들어보세요,1학년 처음 맡았는데 아이들 한글지도를 어떻게 해야할지 큰 그림을 잡아주는 좋은 연수네요 :) ,학습지도,"40,000원",유초등,1
"김영철, 타일러의 진짜 미국식 영어2",30차시,2024-01-09,5,너무 재미있고 유익한 연수였습니다!,너무 재미있고 유익한 연수였습니다!,어학,"75,000원",전체대상,1
이야기가 있는 유쾌한 클래식,30차시,2024-05-08,5,이야기가 있는 유쾌한 클래식 후기,대중음악에 많이 노출되어 있는 우리 아이들에게 재미있는 이야기로 클래식을 지도할 수 있는 알찬 내용으로 구성되어 있습니다.,자기계발,"75,000원",전체대상,1
한국어교원양성과정 Ⅳ,30차시,2024-01-10,5,연수 후기,모르는 내용이 있었는데 덕분에 한국 문화에 대해 자세히 알 수 있었습니다. 한국어 교원양성 자격증 취득하고 싶습니다. ,자기계발,"75,000원",전체대상,1
박진희와 함께 하는 교실 속 환경교육,30차시,2024-01-30,4,추천합니다.,"환경적인 내용은 좋으나, 계속 설명을 들어야하는 수업이라 피로도가 있습니다. 더 다양한 멀티 자료를 보여주면 좋겠습니다.",학습지도,"75,000원",전체대상,0
신영일과 함께하는 안전교육 365,15차시,2023-12-26,5,재미있는 안전연수,의무연수여서 들었는데 재미있게 연수를 받았습니다.,생활지도,"40,000원",전체대상,1
양수쌤의 한 방에 끝나는 놀이체육,30차시,2023-12-25,5,좋은강의 감사합니다.,연수 내용을 보신 옆 반 선생님도 신청하시겠다고 합니다. 수업에 바로 활용할 수 있어서 좋습니다.,교과지도,"75,000원",전체대상,1
"가장 쉬운 수업도구, 패들렛과 띵커벨",15차시,2024-01-03,5,유익한 연수,유익한 연수 감사합니다.,ICT,"40,000원",전체대상,1
재미있는 법률여행,30차시,2024-05-20,5,교직생활 및 평소에 도움이 되는 연수,교직생활 뿐만 아니라 평소 사회생활하는데 도움이 되는 연수였습니다. ,자기계발,"85,000원",전체대상,1
"챗GPT 융합교육 가이드, 인공지능(AI) 챗봇 수업",15차시,2024-05-10,5,AI도구들을 수업에 바로 적용하기 좋은 실제적인 연수였습니다~,AI도구들을 수업에 바로 적용하기 좋은 실제적인 연수였습니다!,학습지도,"50,000원",유초등,1
교사를 위한 구글 활용법(입문자편),15차시,2024-02-04,5,인기 있는 이유가 있었군요.,"구글 혼자 이것저것 시도하며 쓰고 있었는데, 잘 알 고 있다고 생각했는데  연수를 듣고 나니 제가 대충 알고 있었네요. 정말 다양하고 유용한 기능을 활용할 수 있는 좋은 연수였습니다.",ICT,"40,000원",전체대상,1
야나두 미국에서 한 달 살기- 현지 생활 편,30차시,2023-12-15,5,미국에서 한달살기는,굉장히 현실적이면서 다양한 주제로 구성되어 있어서 진짜 미국에 있는 것 같은 느낌이 들 정도로 흥미있는 짜임이었다.식기세척기 사용법이라던가 심지어 변기뚫는 도구 빌리기 같은~ 현실생활에서 유용하게 활용할 만한 내용으로 되어 있어서 많은 도움이 되었다.,어학,"75,000원",전체대상,1
유럽여행을 위한 미술 이야기,30차시,2024-01-09,5,유럽 여행 준비로서 최고!! 강추!!,"유럽 미술에 대한 지식이 부족한 상태에서 유럽 여행가서 알아듣지 못하고 눈으로 감상한 명화들을 시대별 흐름에 따라 강사님들의 친절한 설명으로 이해하는 즐거움이 큰 연수입니다. 더욱이 가지 않은 유럽 미술관도 알게 되어 다시 유럽 여행을 꿈꾸게 합니다. 작품을 감상하며 좋아하는 화가도 만나고, 쉼과 재미를 느끼는 이 연수를 적극 추천합니다. ",자기계발,"75,000원",전체대상,1
단단한 내면의 힘을 기르는 지나영의 코어 마인드,15차시,2024-05-29,5,선 넘는 사람으로부터 나를 지킬 수 있는 용기가 생겼습니다. ,선 넘는 사람으로부터 나를 지킬 수 있는 용기가 생겼습니다. ,자기계발,"50,000원",전체대상,1
"더 나은 교실, 더 나은 미래를 위한 ESG 교육",15차시,2024-04-08,5,문해력 교육,연수를 통해 초기 문해력에 대해 생각해볼 수 있는 기회가 되었습니다.,자기계발,"40,000원",전체대상,1
신영일과 함께하는 안전교육 365,15차시,2024-04-09,5,365일 안전한 생활,"365일 안전한 생활을 하게끔 핵심콕콕 알려주는 신영일과 함께하는 안전교육 365 연수 잘 들었습니다. 유익한 연수이며  언제 들어도 기억하고, 실천해야 할 내용들입니다. 신영일님, 여러 강사님, 고맙습니다.",생활지도,"40,000원",전체대상,1
스피킹맥스 현지에서 통하는 왕기초 영어회화 패턴 120,30차시,2023-12-21,5,일상생활에서 활용할 수 있는 패턴을 알려주셔서 감사해요,처음에는 한국어가 전혀 없어서 당황했지만 자주 사용하는 영어회화 문장을 알려주셔서 집중하며 들을 수 있었어요. 복습을 통해 제것으로 만드는 일만 남았네요. 좋은 강의 감사합니다,어학,"75,000원",전체대상,1
7대 안전 + 감염병! 한 번에 듣는 학교 안전교육,30차시,2024-05-09,5,3년에 한번씩 돌아오는 필수 안전교육 연수!,"올해 새롭게 안전교육 연수를 들어야 한다고 해서 어느 연수원에서 어떤 연수를 골라 들어야 하나 열심히 정보를 탐색중에, 가장 애정하고 활용하고 있는 아이스크림 연수원에 한번에 듣는 학교 안전교육 연수가 있어서 고민없이 바로 수강신청~!!_x000D_
_x000D_
1학점(15시간 )만 이수해도 교육청 필수 이수 요건에는 충족이었지만, 학교에서의 안전은 무엇보다 중요하다고 생각하는 사람이기에 2학점(30시간) 직무연수임에도 망설임 없이 신청했습니다._x000D_
_x000D_
매 시간별로 자세한 안전사고 예방수칙과 대응법을 체계적이고 자세히 설명해주어 큰 도움이 되었습니다._x000D_
_x000D_
안전연수를 고민하고 있는 선생님들께 강력추천합니다!^^_x000D_
_x000D_
",생활지도,"85,000원",전체대상,1
"생각을 꺼내는 교육, 이제는 IB 시대",15차시,2024-05-30,5,교육 패러다임의 변화와 IB,교육의 패러다임 변화에 대한 고민을 생각해보고 흐름을 같이 공유할 수 있어서 좋았습니다. 심화과정을 통해 현장에서의 적용의 실제를 알 수 있으면 좋을 것 같습니다.,학습지도,"50,000원",전체대상,1
한국어교원양성과정 Ⅰ,30차시,2024-01-08,3,교사로서의 나를 되돌아보게 하는 연수,"30년 가까이 교사로서 학생들을 지도해오다, 퇴직 후에 어떤 일을 하면 더욱 뜻깊을 지를 고민하던 참에 결혼이주여성에게 한국어를 가르치는 봉사를 하면 좋겠다는 생각으로 이 연수를 수강하게 되었습니다. _x000D_
이 연수에는 총 네분의 강사분이 수업을 하시는데 강사에 따라 강의의 질이 너무 현격히 차이가 났습니다. _x000D_
한국어문법론을 강의하신 분은 매 차시 수업 시작부터 끝까지 완벽하게 수업을 준비하셨음이 느껴졌고 강의력 또한 탁월하셨습니다. 외국인 학습자에게 한국어를 가르치는 교사로서 반드시 알아야할 점들을 짚어주시는 점도 이 강의의 목적에 부합하였습니다._x000D_
반면 한국어화용론을 강의하신 분은 ppt 자료를 그대로 읽어줄 뿐인데다가 자료의 글도 화용론 영어원서를 직역해놓은 듯하여 무슨 의미인지 도통 와닿지 않아 아쉬움이 너무 컸습니다.(참고로 저는 영어화용론을 바탕으로 석사논문을 썼습니다. 25년 전이라 공부했던 걸 모두 잊었을지도 모르겠군요.)_x000D_
가능하다면 화용론 부분은 다시 강의 영상을 찍어 업로드하는 것이 좋으리라 생각이 듭니다!!!!!!!!!_x000D_
_x000D_
이 연수를 받고나서 저는 본래의 연수 목적을 잊은 채  ‘교사로서의 자신을 되돌아보게’ 되는 성찰의 시간을 얻었습니다.  ‘나는 학생들에게 어떤 교사인가? 학생들로 하여금 공부에 재미와 성취를 갖게 이끄는 교사인가? 아니면 동기유발은커녕 그들이 가졌던 조그만 흥미까지 사그라지게 만드는 교사인가?’   _x000D_
",자기계발,"75,000원",전체대상,0
"질문하는 공부법, 하브루타로 생각하고 실행하기",60차시,2024-02-25,5,살아가면서 많은 곳에서 유용한 공부가 하브루타 실행입니다.,"짝활동이라고 생각하고 자세히 알면 좋겠다는 생각, 짝토론을 수준있게 이끌어주고 싶은 마음에서 다시 공부했습니다. 반복되는 방법을 60시간 연수받으면서 단순한듯 보이기도 하고 접근하기 쉽게 스며드는 매력을 충분히 느꼈습니다. 타인과 이야기하며 살아가는 모든 곳에서 필요한 공부라는 생각을 하였습니다.",학습지도,"130,000원",전체대상,1
학급 관리부터 업무까지 한 방에! 교사를 위한 노션 활용법,15차시,2024-04-24,5,노션활용 추천합니다,"대학에서는 노션 활용이 활성화되어있는데_x000D_
노션의 편리함에 비해 초등에서는 덜 쓰이는 것 같아서 아쉬웠어요_x000D_
이번 연수를 통해 초등맞춤으로 노션을 활용하게 되어서 좋아요 다른 선생님들께도 이 연ㄴㅅ누 추천합니다",ICT,"50,000원",전체대상,1
"핸드메이드 감성 소품, 리본공예",15차시,2024-01-13,5,끈기가 필요한 연수,"다양한 생활상의 소품을 직접 만들어볼 수 있었다는 점이 큰 매력이었다고 생각됩니다. 단, 생각보다 시간이 많이 걸리고 인내심 발휘가 필요하다고 봅니다.",자기계발,"50,000원",전체대상,1
교실을 탈출한 '진짜'영어. 대츠잇!(왕초보편),10차시,2024-04-23,5,교실을 탈출한 진짜 영어,재미있고 새롭네요~,어학,무료,전체대상,1
디지털 드로잉으로 학급경영하기,30차시,2023-12-25,5,연수 추천해요~~^^,"아이패드 유저는 프로크리에이트 어플을 사용해서 드로잉을 할 수 있구요~_x000D_
안드로이드 유저의 경우 메디방을 배울 수 있어요. _x000D_
두 선생님께서 몇회차씩 각각 프로크리에이트와 메디방 수업을 하시는데요~_x000D_
_x000D_
프로크리에이트 선생님은 남자이신데 친절하셔서 기초부터 따라 가면서_x000D_
기본적인 방법과 기술을 익히기에 좋아서 재미있게 보았고_x000D_
메디방 수업 선생님은 여자이신데 그림체가 예쁘고 따라 하고 싶은 기술이 많이 있었어요. ~_x000D_
_x000D_
저같은 경우 프로크리에이트를 배우려는 목적이 컸는데 메디방도 쓸 수 있어서_x000D_
양쪽으로 도움이 되었습니다._x000D_
_x000D_
학급경영에 도움을 받을 수 있을 것 같아요~~ ",학급경영,"75,000원",전체대상,1
ON! 일상을 그린 반려식물 가이드,15차시,2024-03-17,5,반려식물 키우기,"  평소에 식물 키우기가 취미인지라 유튜브에서도 식물관련 내용이 나오면 관심을 가지곤 했다. 한 때는 허브 키우기에 많은 시간을 보냈고 주말 농장을 한 두 해 하며 농작물을 가꿔도 보고 밭에 심어 보고 싶었던 많은 것을 키워보며 시행착오도 해보았다. 정말 농사 일은 너무 힘들구나를 느끼며 내가 사먹는 모든 과일과 채소를 가꿔주시는 분들께 감사한 마음도 더욱 깊어지기도 했다. _x000D_
  가랑코에라는 꽃에 대한 첫인상은 별로 좋지 않아서 '저런 꽃을 왜 키우나'라고 생각한 적도 있었는데 어느 날 보니 그 꽃이 예뻐보여서 키우고 싶다는 생각을 하게 되었다. 일반적인 꽃은 아무리 길어도 일주일 정도면 꽃이 지는데 가랑코에는 그 예쁘고 화려한 꽃을 두 달 이상을 보여주고도 끄떡 없이 우리 집 베란다를 환하게 해줘서 고맙기 그지없는 꽃이 되었다. 한 때는 정말 싫어했던 꽃이 정을 붙이고 예뻐하니 가장 좋아하는 꽃 중에 하나가 된 것이 특별한 경험이었다._x000D_
  그 밖에도 많은 식물을 기르면서 벌레와의 싸움도 많이 하면서 어떤 식물을 우리 집에서 키울 수 있을까해서 우리 집 베란다에서 살아남은 것들은 벌레가 잘 생기지 않는 것들이다. 가랑코에, 장미 허브, 염좌나무, 페퍼민트, 스피아민트, 산세베리아. _x000D_
  이번 연수를 들으면서도 다른 분의 식물을 잘 키우는 노하우를 들을 수 있어서 좋았다. 내가 몰랐던 새로운 도구나 식물을 키우는 데 도움이 되는 정보들은 새로운 자극이 된다. 연수를 들으면서 몬스테리아를 키워보고 싶은 마음이 들었는데 우연히 듣게된 어느 유튜버는 집에서 키우면 안 되는 식물 중 하나를 몬스테리아라고 해서 생각을 유보하기로 했다. _x000D_
  식물 하나를 키우는 것도 생명을 다루는 것이라 정성이 필요하다. 식물에 관심있는 사람이라면 이런 연수를 통해 식물을 가꾸고 정서적인 안정을 갖는 것도 도움이 될 것이라 생각한다. 추가 구성품으로 선택한 화분과 씨앗, 흙 덕분에 올 봄에 새로운 식물이 우리 집을 환하게 밝혀 줄 것이다. 지금 바질과 방울 토마토 싹이 살짝 고개를 내밀도 있다. _x000D_
",자기계발,"40,000원",전체대상,1
학생을 살리는 학교공간혁신,30차시,2023-12-14,3,학교를 다른 역할로 이용하자는 의견은 올바르지 않다고 생각합니다.,학교가 밤이 되고 주말이 되면 공간이 아까우니 이것저것 하자고 하시는데 동의하기 어렵네요. 그렇게 치면 모든 회사나 관공서의 건물을 저녁이나 주말에 활용해야겠죠. 투표권도 없는 약한 아이들이 학교의 주인이라 학교에 대해 이렇게 말도 안되는 생각이 오고가는 건가 많이 의아한 연수였습니다.,자기계발,"75,000원",전체대상,0
"탤짱쌤의 컴퓨터 활용 꼼수, 이제 나도 스마트",15차시,2024-06-10,5,나도 스마트해지기,"경력이 늘어날수록 오히려 디지털, 컴퓨터 관련 수업도구 활용 연수는 더 어려워져만 가네요. 정말 사소한 것도 모르는 가운데, 차근차근 설명해주셔서 너무 좋았습니다. ",ICT,"40,000원",전체대상,1
EBS다큐프라임으로 배우는 생태전환교육,30차시,2024-01-16,5,부자 교사의 재테크,2030 선생님들이 이 연수를 들으면 좋겠습니다. 가장 기초적인 내용일지라도 들은 사람은 은퇴 후 인생이 달라질 것입니다.,학습지도,"75,000원",전체대상,1
다름을 이해하는 교실 속 통합교육,30차시,2023-12-18,5,통합확급,통합학급 경영에 대한 아이디어를 얻었습니다..,생활지도,"65,000원",전체대상,1
교사를 위한 구글 활용법(입문자편),15차시,2024-02-26,5,유익한 연수를 잘 받았습니다.,유익한 연수 잘 들었습니다. 감사합니다. ^^~,ICT,"40,000원",전체대상,1
이제 제대로 놀아보자! 쏭쌤의 신체 활용 인성 놀이,30차시,2024-05-01,4,잘 듣고 갑니다.,"잘 듣고 갑니다._x000D_
수고하세요",교과지도,"75,000원",유초등,0
나만의 이미지 가치를 높여주는 퍼스널 컬러 스타일링,15차시,2023-12-13,5,펄스널 컬러에 대해 알게됐어요,펄스널 컬러에 대해 알게됐어요,자기계발,"40,000원",전체대상,1
알면 편한 심리학 with 유미의 세포들,30차시,2024-03-06,5,좋은 강의였어요 고마워요.,좋은 강의였어요 고마워요.,자기계발,"75,000원",전체대상,1
한국어교원양성과정 Ⅰ,30차시,2024-01-13,5,국어가 참 어려워요.,경력이 더 쌓일수록 국어 교수가 쉽지 않아요!,자기계발,"75,000원",전체대상,1
